{
  "id": "library:lightgbm-catboost",
  "type": "library",
  "title": "LightGBM & CatBoost — Gradient Boosting Alternatives",
  "slug": "lightgbm-catboost",
  "aliases": [],
  "tags": [
    "lightgbm",
    "catboost",
    "gradient-boosting",
    "tabular",
    "framework",
    "tool"
  ],
  "status": "active",
  "wiki_path": "wiki/entities/lightgbm-catboost.md",
  "summary": "---",
  "source_refs": [],
  "confidence": 1.0,
  "provenance": {
    "ingested_from": [
      "wiki/entities/lightgbm-catboost.md"
    ],
    "method": "parser",
    "extractor_version": "0.3.0"
  },
  "version": 1,
  "created": "2026-04-14",
  "updated": "2026-04-14"
}
